{
  "$schema": "https://json-schema.org/draft/2020-12/schema",
  "title": "LusorisKernelForgeVersions",
  "type": "object",
  "required": [
    "metadata",
    "streams",
    "architectures",
    "downstream"
  ],
  "$defs": {
    "signers": {
      "description": "Primary-key fingerprints whose signature is accepted for a source. Each has an armored key at keys/<FINGERPRINT>.asc; a signature by any other key is refused.",
      "type": "array",
      "minItems": 1,
      "uniqueItems": true,
      "items": {"type": "string", "pattern": "^[0-9A-F]{40}$"}
    },
    "tarball_source": {
      "description": "A kernel.org release tarball. Its detached signature covers the uncompressed tar; sha256 pins the .tar.xz as downloaded.",
      "type": "object",
      "required": ["kind", "url", "signature_url", "sha256", "signers"],
      "additionalProperties": false,
      "properties": {
        "kind": {"const": "tarball"},
        "url": {"type": "string", "pattern": "^https://[^\\s]+/linux-[0-9][0-9A-Za-z.-]*[.]tar[.]xz$"},
        "signature_url": {"type": "string", "pattern": "^https://[^\\s]+/linux-[0-9][0-9A-Za-z.-]*[.]tar[.]sign$"},
        "sha256": {"type": "string", "pattern": "^[0-9a-f]{64}$"},
        "signers": {"$ref": "#/$defs/signers"}
      }
    },
    "git_tag_source": {
      "description": "A signed tag of a kernel git repository, for a release that has no signed tarball (a release candidate). git verify-tag checks the tag, and it must point at the pinned commit.",
      "type": "object",
      "required": ["kind", "repository", "tag", "commit", "signers"],
      "additionalProperties": false,
      "properties": {
        "kind": {"const": "git-tag"},
        "repository": {"type": "string", "pattern": "^https://[^\\s]+$"},
        "tag": {"type": "string", "pattern": "^v[0-9][0-9A-Za-z.-]*$"},
        "commit": {"type": "string", "pattern": "^[0-9a-f]{40}$"},
        "signers": {"$ref": "#/$defs/signers"}
      }
    }
  },
  "properties": {
    "metadata": {
      "type": "object",
      "required": ["repository", "upstream", "updated"],
      "properties": {
        "repository": {"type": "string"},
        "upstream": {"type": "string", "format": "uri"},
        "updated": {"type": "string"}
      }
    },
    "streams": {
      "type": "object",
      "required": ["bleeding", "mainstream", "lts", "realtime"],
      "additionalProperties": {
        "type": "object",
        "required": ["version", "tag", "status", "description", "source"],
        "additionalProperties": false,
        "properties": {
          "version": {"type": "string", "pattern": "^[0-9]+[.][0-9]+([.][0-9]+)?(-rc[0-9]+)?$"},
          "tag": {"type": "string", "pattern": "^v[0-9][0-9A-Za-z.-]*$"},
          "status": {"type": "string"},
          "description": {"type": "string"},
          "source": {
            "description": "Where the stream's kernel source comes from and how it is proven (docs/adr/0008). scripts/fetch-kernel-source.sh refuses a source whose signature or pin does not hold.",
            "oneOf": [{"$ref": "#/$defs/tarball_source"}, {"$ref": "#/$defs/git_tag_source"}]
          }
        }
      }
    },
    "architectures": {
      "description": "The architectures every stream is built for, keyed by the name this forge uses (kconfig/<arch>.config, the build matrix).",
      "type": "object",
      "minProperties": 1,
      "propertyNames": {"pattern": "^[a-z0-9_]+$"},
      "additionalProperties": {
        "type": "object",
        "required": ["kernel_arch", "base_config", "cross_compile", "debian_arch"],
        "additionalProperties": false,
        "properties": {
          "kernel_arch": {"description": "The ARCH= value the kernel build takes.", "type": "string", "pattern": "^[a-z0-9_]+$"},
          "base_config": {"description": "The in-tree defconfig target the fragments are merged onto.", "type": "string", "pattern": "^[a-z0-9_]*defconfig$"},
          "cross_compile": {
            "description": "The CROSS_COMPILE prefix of the GNU toolchain for this architecture. It is set on every host, the native one included, so compiler-dependent symbols resolve against the compiler that builds.",
            "type": "string",
            "pattern": "^[a-z0-9_]+(-[a-z0-9_]+)*-$"
          },
          "debian_arch": {
            "description": "The Debian architecture of the packages bindeb-pkg builds for it; the artifact gate refuses a package of any other.",
            "type": "string",
            "pattern": "^[a-z0-9]+$"
          }
        }
      }
    },
    "downstream": {
      "type": "object",
      "required": ["repository", "sync_event", "requirements", "requirement_schema"],
      "properties": {
        "repository": {"type": "string"},
        "sync_event": {"type": "string"},
        "requirements": {
          "description": "Kernel requirement documents (aegis.p01-nucleus.kernel-requirement.v1) checked by verify-requirements.yml. A dispatched source's dispatch carries a ref and sha256 that are proven before the document is used; the others are read at the resolved commit of their default branch. Labels are unique and every bound stream is a key of streams (tests/test_verify_kernel_requirement.py).",
          "type": "array",
          "minItems": 1,
          "items": {
            "type": "object",
            "required": ["label", "repository", "path", "dispatched", "streams"],
            "additionalProperties": false,
            "properties": {
              "label": {"type": "string", "pattern": "^[a-z0-9][a-z0-9-]*$"},
              "repository": {"type": "string", "pattern": "^[A-Za-z0-9_.-]+/[A-Za-z0-9_.-]+$"},
              "path": {
                "description": "Repository-relative path; every segment starts with a character other than a dot, so '.', '..' and an absolute path are refused.",
                "type": "string",
                "pattern": "^[A-Za-z0-9_-][A-Za-z0-9_.-]*(/[A-Za-z0-9_-][A-Za-z0-9_.-]*)*[.]json$"
              },
              "dispatched": {"type": "boolean"},
              "streams": {
                "description": "The streams this consumer is bound to. Every bound stream must satisfy the document; the other streams are reported as information only.",
                "type": "array",
                "minItems": 1,
                "uniqueItems": true,
                "items": {"type": "string", "pattern": "^[a-z][a-z0-9-]*$"}
              }
            }
          }
        },
        "requirement_schema": {
          "description": "The JSON Schema (draft 2020-12) the contract owner publishes for the requirement documents, pinned by commit and sha256, and the copy vendored for the offline tests. It applies to every row of requirements. verify-requirements.yml fetches it at the commit, checks the digest and validates each fetched document against it before the verifier runs (docs/adr/0010). To refresh it, see docs/streams.md.",
          "type": "object",
          "required": ["repository", "path", "commit", "sha256", "vendored"],
          "additionalProperties": false,
          "properties": {
            "repository": {"type": "string", "pattern": "^[A-Za-z0-9_.-]+/[A-Za-z0-9_.-]+$"},
            "path": {
              "description": "Repository-relative path in the owner's repository, by the same grammar as the paths of requirements.",
              "type": "string",
              "pattern": "^[A-Za-z0-9_-][A-Za-z0-9_.-]*(/[A-Za-z0-9_-][A-Za-z0-9_.-]*)*[.]json$"
            },
            "commit": {"description": "The full commit the schema is read at.", "type": "string", "pattern": "^[0-9a-f]{40}$"},
            "sha256": {"description": "The digest of the schema file at that commit.", "type": "string", "pattern": "^[0-9a-f]{64}$"},
            "vendored": {
              "description": "This repository's copy of the schema, byte-identical to the pinned file (tests/test_requirement_schema.py).",
              "type": "string",
              "pattern": "^[A-Za-z0-9_-][A-Za-z0-9_.-]*(/[A-Za-z0-9_-][A-Za-z0-9_.-]*)*[.]json$"
            }
          }
        }
      }
    },
    "patches": {
      "description": "Patch series carried from an upstream repository, each pinned by commit. scripts/check_patches_apply.py requires patches/<series>/ to hold one file per commit, in order, each starting with 'From <commit> '.",
      "type": "object",
      "additionalProperties": false,
      "patternProperties": {
        "^[a-z][a-z0-9-]*$": {
          "type": "object",
          "required": ["description", "repository", "ref", "commit", "base", "licence", "streams", "commits"],
          "additionalProperties": false,
          "properties": {
            "description": {"type": "string", "minLength": 1},
            "repository": {"description": "The upstream git repository.", "type": "string", "pattern": "^https://[^\\s]+$"},
            "ref": {"description": "The upstream branch or tag the series was taken from; informational, the commits are the pin.", "type": "string", "minLength": 1},
            "commit": {"description": "The commit ref pointed at when the series was taken.", "type": "string", "pattern": "^[0-9a-f]{40}$"},
            "base": {"description": "The upstream parent of the first commit of the series.", "type": "string", "pattern": "^[0-9a-f]{40}$"},
            "licence": {"description": "SPDX expression of the code the series adds.", "type": "string", "minLength": 1},
            "streams": {"type": "array", "minItems": 1, "uniqueItems": true, "items": {"type": "string", "pattern": "^[a-z][a-z0-9-]*$"}},
            "commits": {"description": "The commits of the series, in the order they apply.", "type": "array", "minItems": 1, "uniqueItems": true, "items": {"type": "string", "pattern": "^[0-9a-f]{40}$"}}
          }
        }
      }
    },
    "schedulers": {
      "description": "sched_ext schedulers from the kernel tree's tools/sched_ext that the x86_64 boot smoke loads, each bound to the streams whose tree builds it against its own kernel.",
      "type": "object",
      "additionalProperties": false,
      "patternProperties": {
        "^[a-z][a-z0-9_]*$": {
          "type": "object",
          "required": ["description", "streams"],
          "additionalProperties": false,
          "properties": {
            "description": { "type": "string", "minLength": 1 },
            "streams": {
              "type": "array",
              "minItems": 1,
              "uniqueItems": true,
              "items": { "type": "string", "pattern": "^[a-z][a-z0-9-]*$" }
            }
          }
        }
      }
    },
    "modules": {
      "type": "object",
      "additionalProperties": false,
      "properties": {
        "openzfs": {
          "type": "object",
          "required": [
            "version",
            "source",
            "linux_minimum",
            "linux_maximum"
          ],
          "additionalProperties": false,
          "properties": {
            "version": {
              "type": "string",
              "pattern": "^[0-9]+[.][0-9]+([.][0-9]+)?$"
            },
            "source": {
              "type": "object",
              "required": [
                "kind",
                "url",
                "signature_url",
                "sha256",
                "signers"
              ],
              "additionalProperties": false,
              "properties": {
                "kind": {
                  "const": "tarball"
                },
                "url": {
                  "type": "string",
                  "pattern": "^https://[^\\s]+/zfs-[0-9][0-9A-Za-z.-]*[.]tar[.]gz$"
                },
                "signature_url": {
                  "type": "string",
                  "pattern": "^https://[^\\s]+/zfs-[0-9][0-9A-Za-z.-]*[.]tar[.]gz[.]asc$"
                },
                "sha256": {
                  "type": "string",
                  "pattern": "^[0-9a-f]{64}$"
                },
                "signers": {
                  "$ref": "#/$defs/signers"
                }
              }
            },
            "linux_minimum": {
              "type": "string",
              "pattern": "^[0-9]+[.][0-9]+$"
            },
            "linux_maximum": {
              "type": "string",
              "pattern": "^[0-9]+[.][0-9]+$"
            }
          }
        },
        "nvidia_open": {
          "type": "object",
          "required": [
            "version",
            "source",
            "streams",
            "architectures"
          ],
          "additionalProperties": false,
          "properties": {
            "$comment": {
              "type": "string"
            },
            "version": {
              "type": "string",
              "pattern": "^[0-9]+[.][0-9]+([.][0-9]+)?$"
            },
            "source": {
              "type": "object",
              "required": [
                "kind",
                "url",
                "sha256",
                "commit"
              ],
              "additionalProperties": false,
              "properties": {
                "$comment": {
                  "type": "string"
                },
                "kind": {
                  "const": "tarball"
                },
                "url": {
                  "type": "string",
                  "pattern": "^https://[^\\s]+/open-gpu-kernel-modules/archive/refs/tags/[0-9][0-9A-Za-z.-]*[.]tar[.]gz$"
                },
                "sha256": {
                  "type": "string",
                  "pattern": "^[0-9a-f]{64}$"
                },
                "commit": {
                  "type": "string",
                  "pattern": "^[0-9a-f]{40}$"
                }
              }
            },
            "streams": {
              "type": "array",
              "minItems": 1,
              "uniqueItems": true,
              "items": {
                "type": "string"
              }
            },
            "architectures": {
              "type": "array",
              "minItems": 1,
              "uniqueItems": true,
              "items": {
                "type": "string"
              }
            }
          }
        }
      }
    }
  }
}
