{
  "$schema": "./versions.schema.json",
  "metadata": {
    "repository": "nucleus",
    "upstream": "https://www.kernel.org",
    "updated": "2026-10-14"
  },
  "streams": {
    "bleeding": {
      "version": "7.3-rc7",
      "tag": "v7.3-rc7",
      "status": "mainline",
      "description": "Bleeding edge mainline kernel for next-gen hardware (Blackwell RTX 5090/B200, CXL 3.0, sched-ext).",
      "source": {
        "kind": "git-tag",
        "repository": "https://git.kernel.org/pub/scm/linux/kernel/git/torvalds/linux.git",
        "tag": "v7.3-rc7",
        "commit": "24a19b953e2a3d0ea5a8c4951a0ab8f32720c907",
        "signers": [
          "ABAF11C65A2970B130ABE3C479BE3E4300411886"
        ]
      }
    },
    "mainstream": {
      "version": "7.2.10",
      "tag": "v7.2.10",
      "status": "stable",
      "description": "Production stable stream for Intel Battlemage Xe2, AMD ROCm 10, and NVIDIA 565/610.",
      "source": {
        "kind": "tarball",
        "url": "https://cdn.kernel.org/pub/linux/kernel/v7.x/linux-7.2.10.tar.xz",
        "signature_url": "https://cdn.kernel.org/pub/linux/kernel/v7.x/linux-7.2.10.tar.sign",
        "sha256": "2feaa70453e91f541be6a5c9078d8168e081af45a3d9718054850538cff2ebf3",
        "signers": [
          "647F28654894E3BD457199BE38DBBDC86092693E"
        ]
      }
    },
    "lts": {
      "version": "6.18.56",
      "tag": "v6.18.56",
      "status": "longterm",
      "description": "Long-term support stream for enterprise Kubernetes nodes, OpenZFS 2.3, and CNPG.",
      "source": {
        "kind": "tarball",
        "url": "https://cdn.kernel.org/pub/linux/kernel/v6.x/linux-6.18.56.tar.xz",
        "signature_url": "https://cdn.kernel.org/pub/linux/kernel/v6.x/linux-6.18.56.tar.sign",
        "sha256": "4633bbda2ab95eaf2a7af4041236451d6759c72e6946265531af4b3aacefbf89",
        "signers": [
          "647F28654894E3BD457199BE38DBBDC86092693E"
        ]
      }
    },
    "realtime": {
      "version": "7.2.10",
      "tag": "v7.2.10",
      "status": "preempt_rt",
      "description": "Full PREEMPT_RT deterministic low-latency stream for edge and real-time workloads, built from the mainline stable release with the in-tree PREEMPT_RT option.",
      "source": {
        "kind": "tarball",
        "url": "https://cdn.kernel.org/pub/linux/kernel/v7.x/linux-7.2.10.tar.xz",
        "signature_url": "https://cdn.kernel.org/pub/linux/kernel/v7.x/linux-7.2.10.tar.sign",
        "sha256": "2feaa70453e91f541be6a5c9078d8168e081af45a3d9718054850538cff2ebf3",
        "signers": [
          "647F28654894E3BD457199BE38DBBDC86092693E"
        ]
      }
    }
  },
  "architectures": {
    "x86_64": {
      "kernel_arch": "x86_64",
      "base_config": "x86_64_defconfig",
      "cross_compile": "x86_64-linux-gnu-",
      "debian_arch": "amd64"
    },
    "arm64": {
      "kernel_arch": "arm64",
      "base_config": "defconfig",
      "cross_compile": "aarch64-linux-gnu-",
      "debian_arch": "arm64"
    },
    "riscv64": {
      "kernel_arch": "riscv",
      "base_config": "defconfig",
      "cross_compile": "riscv64-linux-gnu-",
      "debian_arch": "riscv64"
    }
  },
  "downstream": {
    "repository": "cordanaLLM/imago",
    "sync_event": "kernel_release_published",
    "requirements": [
      {
        "label": "imago",
        "repository": "cordanaLLM/imago",
        "path": "kernel/requirement.json",
        "dispatched": true,
        "streams": [
          "bleeding",
          "mainstream",
          "lts",
          "realtime"
        ]
      },
      {
        "label": "aegis-os",
        "repository": "cordanaLLM/Aegis-OS",
        "path": "build/kernel-requirement.json",
        "dispatched": false,
        "streams": [
          "realtime"
        ]
      }
    ],
    "requirement_schema": {
      "repository": "cordanaLLM/Aegis-OS",
      "path": "build/kernel-requirement.schema.json",
      "commit": "e3fe08a0eb622b438569198f0679f8ce935533c7",
      "sha256": "99ece6bacbb1bbd2534bbe9cf073027b2e364e8eb3d329ea68b675e2eca87019",
      "vendored": "tests/fixtures/kernel-requirement/aegis-kernel-requirement.schema.json"
    }
  }
}
